domain|framework|key_questions|areas
concept|Five Whys|Why does this exist? Who needs it? What problem does it solve? How is it unique? What's the vision?|Purpose,Value,Problem,Uniqueness,Vision
history|Timeline Analysis|What came before this? How has this concept evolved? What are key moments in its history? What's the current state?|Origins,Evolution,Milestones,Current State,Future
metaphor|Domain Mapping|What is this like in nature? How is it like technology? What art movements does it resemble? What historical parallels exist?|Nature,Tech,Art,History,Psychology
cultural|Reference Discovery|What cultural moments does this connect to? What subcultures or communities relate to this? What symbols are associated?|Movements,Communities,Symbols,Archetypes,Zeitgeist
visual|Style Matching|How should this look? What era's aesthetics apply? What's the mood? What colors and typography suit this?|Aesthetics,Mood,Color,Typography,Era
